{
  "meta": {
    "formatVersion": "1.5.0",
    "projectName": "sample-cafe",
    "languages": [
      "zh"
    ],
    "baseLanguage": "zh",
    "updatedAt": "2026-10-24T12:06:57.807Z",
    "tagSyntax": "bracket"
  },
  "tagRegistry": [
    {
      "name": "b",
      "kind": "paired",
      "params": [],
      "description": "粗體"
    },
    {
      "name": "i",
      "kind": "paired",
      "params": [],
      "description": "斜體"
    },
    {
      "name": "color",
      "kind": "paired",
      "positional": "value",
      "params": [
        {
          "name": "value",
          "type": "color",
          "description": "十六進位色碼，例 #ff3333"
        }
      ],
      "description": "文字顏色"
    },
    {
      "name": "size",
      "kind": "paired",
      "positional": "value",
      "params": [
        {
          "name": "value",
          "type": "number",
          "default": 1.5,
          "description": "相對於基準字級的倍率"
        }
      ],
      "description": "文字大小（倍率）"
    },
    {
      "name": "font",
      "kind": "paired",
      "positional": "value",
      "params": [
        {
          "name": "value",
          "type": "string",
          "description": "字型代號，兩端各自對應到實際字型資產"
        }
      ],
      "description": "切換字型"
    },
    {
      "name": "shake",
      "kind": "paired",
      "params": [
        {
          "name": "amp",
          "type": "number",
          "default": 2,
          "description": "振幅（像素／單位）"
        },
        {
          "name": "freq",
          "type": "number",
          "default": 20,
          "description": "頻率（每秒）"
        }
      ],
      "description": "逐字抖動"
    },
    {
      "name": "wave",
      "kind": "paired",
      "params": [
        {
          "name": "amp",
          "type": "number",
          "default": 3,
          "description": "振幅"
        },
        {
          "name": "freq",
          "type": "number",
          "default": 2,
          "description": "頻率（每秒）"
        }
      ],
      "description": "波浪起伏"
    },
    {
      "name": "speed",
      "kind": "paired",
      "positional": "value",
      "params": [
        {
          "name": "value",
          "type": "number",
          "default": 0.5,
          "description": "相對於基準速度的倍率，小於 1 為變慢"
        }
      ],
      "description": "逐字速度（作用於選取範圍）"
    },
    {
      "name": "wait",
      "kind": "inline",
      "positional": "value",
      "params": [
        {
          "name": "value",
          "type": "number",
          "default": 0.3,
          "description": "停頓秒數"
        }
      ],
      "description": "停頓"
    },
    {
      "name": "sfx",
      "kind": "inline",
      "positional": "value",
      "params": [
        {
          "name": "value",
          "type": "string",
          "description": "音效代號"
        }
      ],
      "description": "播放音效"
    }
  ],
  "variables": [
    {
      "id": "trust",
      "type": "number",
      "default": 0,
      "description": "店長對新人的信任",
      "label": "信任"
    },
    {
      "id": "motivation",
      "type": "number",
      "default": 0,
      "description": "新人的幹勁",
      "label": "幹勁"
    },
    {
      "id": "skillExp",
      "type": "number",
      "default": 0,
      "description": "做咖啡的熟練度經驗值",
      "label": "熟練度EXP"
    },
    {
      "id": "newcomerName",
      "type": "string",
      "default": "",
      "description": "輸入欄的標題",
      "label": "新人的名字"
    },
    {
      "id": "practice",
      "type": "number",
      "default": 0,
      "description": ""
    }
  ],
  "characters": [
    {
      "id": "char-1",
      "name": {
        "zh": "店長"
      }
    },
    {
      "id": "char-2",
      "name": {
        "zh": "新人"
      }
    },
    {
      "id": "char-3",
      "name": {
        "zh": "新人 os"
      }
    },
    {
      "id": "system",
      "name": {
        "zh": "system"
      }
    },
    {
      "id": "char-4",
      "name": {
        "zh": "熟客"
      }
    },
    {
      "id": "char-5",
      "name": {
        "zh": "新人 mind"
      }
    }
  ],
  "scenes": [
    {
      "id": "01M5PW1SJ3XRM54B8W3BYDENCE",
      "name": "第一幕-開幕前一天",
      "entryNodeId": "01M5PW1SJ1EEQV9MHF8H8W4S8Q",
      "nodes": [
        {
          "id": "01M5PW1SJ1EEQV9MHF8H8W4S8Q",
          "text": {
            "zh": "開幕前一天，早上七點。咖啡店的鐵捲門還拉著一半。"
          },
          "choices": [],
          "next": "01M5PW1SJ2CQV5KD9CXV8VMRZB",
          "actions": [],
          "notes": "",
          "branches": [],
          "extras": {
            "人物": "narration"
          },
          "source": {
            "id": "0",
            "marker": "#",
            "group": ""
          },
          "sourceJump": "1",
          "stage": {
            "background": "店門口-清晨",
            "screenEffect": "睜眼效果",
            "bgm": "早晨的店 2"
          },
          "kind": "line"
        },
        {
          "id": "01M5PW1SJ2CQV5KD9CXV8VMRZB",
          "text": {
            "zh": "早安。今天要把[b]菜單[/b]和流程都定下來。"
          },
          "choices": [],
          "next": "01M5PW1SJ2V8W4BY0NE60NS9GK",
          "actions": [],
          "notes": "",
          "branches": [],
          "speaker": "char-1",
          "extras": {},
          "source": {
            "id": "1",
            "marker": "#",
            "group": ""
          },
          "sourceJump": "2",
          "stage": {
            "position": "左",
            "portraitEffect": "淡入",
            "sfx": "鐵捲門"
          },
          "kind": "line",
          "portrait": "店長-微笑"
        },
        {
          "id": "01M5PW1SJ2V8W4BY0NE60NS9GK",
          "text": {
            "zh": "是、是的！請多指教！"
          },
          "choices": [],
          "next": "01M5PW1SJ2V8KGCGJV1CNA8VJA",
          "actions": [],
          "notes": "",
          "branches": [],
          "speaker": "char-2",
          "extras": {},
          "source": {
            "id": "2",
            "marker": "#",
            "group": ""
          },
          "sourceJump": "3",
          "stage": {
            "position": "右",
            "portraitEffect": "右滑入",
            "attributes": "幹勁+1"
          },
          "kind": "line",
          "portrait": "新人-緊張"
        },
        {
          "id": "01M5PW1SJ2V8KGCGJV1CNA8VJA",
          "text": {
            "zh": "[i]（第一天上班……手心都是汗。）[/i]"
          },
          "choices": [],
          "next": "01M5PW1SJ2GSSZ3T0D5T1BK15Z",
          "actions": [],
          "notes": "",
          "branches": [],
          "speaker": "char-3",
          "extras": {},
          "source": {
            "id": "3",
            "marker": "#",
            "group": ""
          },
          "sourceJump": "4",
          "kind": "line"
        },
        {
          "id": "01M5PW1SJ2GSSZ3T0D5T1BK15Z",
          "text": {
            "zh": "先進來吧，今天的工作很多。"
          },
          "choices": [],
          "next": "01M5PW1SJ23C63KC62RJNMBJ9E",
          "actions": [],
          "notes": "",
          "branches": [],
          "speaker": "char-1",
          "extras": {},
          "source": {
            "id": "4",
            "marker": "#",
            "group": ""
          },
          "sourceJump": "5",
          "stage": {
            "background": "店內-白天",
            "screenEffect": "溶接 0.8"
          },
          "kind": "line"
        },
        {
          "id": "01M5PW1SJ23C63KC62RJNMBJ9E",
          "text": {
            "zh": "先說清楚流程。開店前要確認咖啡機的水壓、磨豆機的刻度、牛奶的溫度，還有收銀台的零錢。每一樣都要寫在檢查表上，簽名之後才算完成。客人進門時先打招呼，點單時複誦一次，出杯時再確認一次名字。忙的時候不要急著說話，先把手上的那一杯做好。打烊後要清洗蒸氣管、倒掉剩下的熱水、把豆子密封好放回櫃子。另外，今天下午會有廠商送牛奶和紙杯過來，數量要點清楚再簽收；冰箱的溫度記錄每兩個小時寫一次。菜單板上的價格我晚一點再確認，先不要貼上去。如果咖啡機出現奇怪的聲音，先關掉電源再叫我，不要自己拆開來看。"
          },
          "choices": [],
          "next": "01M5PW1SJ2JVREMZMQSNV31Y9V",
          "actions": [],
          "notes": "",
          "branches": [],
          "speaker": "char-1",
          "extras": {},
          "source": {
            "id": "5",
            "marker": "#",
            "group": ""
          },
          "sourceJump": "6",
          "kind": "line",
          "portrait": "店長-嚴肅"
        },
        {
          "id": "01M5PW1SJ2JVREMZMQSNV31Y9V",
          "text": {},
          "choices": [],
          "next": "01M5PW1SJ2HGGFQ5FFHJRPYGFD",
          "actions": [],
          "notes": "",
          "branches": [],
          "speaker": "system",
          "extras": {},
          "source": {
            "id": "6",
            "marker": "in",
            "group": ""
          },
          "sourceJump": "7",
          "stage": {
            "screenEffect": "OpenNameInput"
          },
          "kind": "input",
          "expression": "newcomerName"
        },
        {
          "id": "01M5PW1SJ2HGGFQ5FFHJRPYGFD",
          "text": {
            "zh": "<newcomerName>，對吧？我記住了。"
          },
          "choices": [],
          "next": "01M5PW1SJ2C7KRY2N8ZGNCZ8E9",
          "actions": [],
          "notes": "",
          "branches": [],
          "speaker": "char-1",
          "extras": {},
          "source": {
            "id": "7",
            "marker": "#",
            "group": ""
          },
          "sourceJump": "8",
          "stage": {
            "attributes": "信任+1"
          },
          "kind": "line"
        },
        {
          "id": "01M5PW1SJ2C7KRY2N8ZGNCZ8E9",
          "text": {},
          "choices": [],
          "next": "01M5PW1SJ2Y3TCV7N8ZZYCAG4H",
          "actions": [],
          "notes": "",
          "branches": [],
          "speaker": "system",
          "extras": {},
          "source": {
            "id": "8",
            "marker": "set",
            "group": ""
          },
          "sourceJump": "9",
          "kind": "set",
          "expression": "practice = 0"
        },
        {
          "id": "01M5PW1SJ2Y3TCV7N8ZZYCAG4H",
          "text": {
            "zh": "兩人走到吧台前，試做了第一杯拿鐵。"
          },
          "choices": [],
          "next": "01M5PW1SJ2BX2NWJ50D1S5444C",
          "actions": [],
          "notes": "",
          "branches": [],
          "extras": {
            "人物": "narration"